{
  "version": "0.1.0",
  "units": "mm",
  "tolerance": 0.001,
  "metadata": {
    "created": "2025-09-13T12:00:00Z",
    "author": "BrepFlow Examples",
    "description": "Simple parametric box"
  },
  "nodes": [
    {
      "id": "box1",
      "type": "Solid::Box",
      "position": { "x": 100, "y": 100 },
      "inputs": {},
      "params": {
        "width": 100,
        "height": 60,
        "depth": 40
      }
    },
    {
      "id": "fillet1",
      "type": "Features::Fillet",
      "position": { "x": 300, "y": 100 },
      "inputs": {
        "shape": { "nodeId": "box1", "socketId": "shape" }
      },
      "params": {
        "radius": 5,
        "selectAll": true
      }
    },
    {
      "id": "export1",
      "type": "IO::ExportSTEP",
      "position": { "x": 500, "y": 100 },
      "inputs": {
        "shapes": [{ "nodeId": "fillet1", "socketId": "shape" }]
      },
      "params": {
        "filepath": "output.step",
        "asAssembly": false
      }
    }
  ],
  "edges": [
    {
      "id": "e1",
      "source": "box1",
      "sourceHandle": "shape",
      "target": "fillet1",
      "targetHandle": "shape"
    },
    {
      "id": "e2",
      "source": "fillet1",
      "sourceHandle": "shape",
      "target": "export1",
      "targetHandle": "shapes"
    }
  ]
}
